{"childAggregateHash":"0000000000000000000000000000000000000000000000000000000000000000","childCount":0,"children":[],"chunkProfileHash":"0000000000000000000000000000000000000000000000000000000000000000","joinerAggregateHash":"0000000000000000000000000000000000000000000000000000000000000000","joinerCount":0,"parentAggregateHash":"0000000000000000000000000000000000000000000000000000000000000000","parentCount":0,"parents":[],"schemaVersion":"chunk-manifest.v2","sourceSha256":"0000000000000000000000000000000000000000000000000000000000000000","spanAggregateHash":"0000000000000000000000000000000000000000000000000000000000000000","spanCount":0}